text,id,length,has_url,has_phone,label
"이번 주 토요일 저녁에 영화 보러 갈 건데, 같이 갈래? 연락은 <PHONE>으로 해줘~ㅎㅎ",ham_inf_3682,51,0,1,0
이번 주말에 시간 돼? 그때 <URL>에서 예약한 카페 가보고 싶은데 너도 같이 가자~ 😊,ham_inf_3683,50,1,0,0
"어제 저녁에 그 맛집 갔는데 진짜 최고였어! (<URL>) 다음에 같이 가자, 여기 예약할 때 전화번호도 <PHONE>이니까 참고해~ ㅎㅎ",ham_inf_3684,77,1,1,0
"주말에 영화 보러 가는데, 몇 시에 만날지 전화번호 알려줘 <PHONE>! ㅎㅎ 그래야 빠르게 연락할 수 있잖아!",ham_inf_3685,63,0,1,0
"야, 요즘 너무 바빠서 정신 없는데 <URL>에서 뭐 재밌는 거 발견했어! 너도 꼭 가서 보고 해볼래? 😄 그리고 전화도 한 번 해보자, <PHONE>으로 연락 줘!",ham_inf_3686,92,1,1,0
"이번 주말에 영화 보러 가고 싶은데, 여기 예매 링크 줌! <URL> 이거 딱이야! ㅎㅎ",ham_inf_3687,49,1,0,0
"야, 이번 주말에 그 카페 가려고 하는데, 여기 링크 첨부할게 <URL>! 혹시 시간 되면 나랑 같이 갈래? 😊 전화번호는 <PHONE>으로 연락해줘~!",ham_inf_3688,85,1,1,0
"야, 그 영화 예고편 봤어? 진짜 재밌을 것 같은데, 여기 링크 보내줄게! <URL> 그리고 다음 주 수요일에 보러 가려고 하는데 너도 같이 갈래? <PHONE>으로 연락 줘! 😊",ham_inf_3689,100,1,1,0
오늘 점심 뭐 먹을까? 내가 추천할 만한 밥집 여기 있어! <URL> 한번 확인해봐~ 😊,ham_inf_3690,49,1,0,0
"다음 주에 그 전시회 간다는데, 여기 링크 봐봐 <URL> 재밌을 것 같아! 😄 진짜 기대된다!",ham_inf_3691,53,1,0,0
"이번 주 주말에 맛있는 거 먹으러 가고 싶은데, 추천 식당 여기서 확인해봐! <URL> ㅎㅎ",ham_inf_3692,51,1,0,0
"오늘 저녁 뭐 먹을까? 맛집 찾다가 여기 웹사이트 우연히 발견했어! <URL> 꼭 확인해봐, 완전 맛있대 ㅎㅎ",ham_inf_3693,61,1,0,0
"이번 주 금요일에 영화 보러 가는데, 혹시 <PHONE>로 연락할 수 있어? 같이 가면 좋겠다! ㅎㅎ",ham_inf_3694,56,0,1,0
"이번주에 새로운 카페 갔는데 진짜 맛있더라! 위치는 <URL>이고, 전화는 <PHONE>이야. 언제 한번 같이 가자~ 😊",ham_inf_3695,67,1,1,0
요즘 날씨도 좋고 그러니까 나랑 주말에 산책하면서 커피 한잔 할래? 만약 시간 괜찮으면 이 번호로 연락 줘 <PHONE>! 그리고 여기 링크도 참고해봐 <URL> 😊,ham_inf_3696,92,1,1,0
"어이, 요즘 어떻게 지내? 지난주에 그 카페 진짜 좋더라, 여기 링크도 보너스로 줄게 <URL>. 나중에 같이 가자! 전화번호는 <PHONE>으로 저장해 둬~ ㅋㅋ",ham_inf_3697,91,1,1,0
주말에 나랑 맛집 가고 싶으면 여기 링크 클릭해봐 <URL> ㅋㅋ 진짜 대박 맛있어~,ham_inf_3698,47,1,0,0
"야, 이번 주에 영화 보러 가자~ 예매는 여기서 하면 되는데 <URL> 있어! 그리고 시간도 맞춰야 하니까 전화해줘! <PHONE> 😊",ham_inf_3699,75,1,1,0
"요즘 너무 심심한데, <URL> 여기 가면 재밌는 영상 많아!! 꼭 한 번 보세요~ ㅎㅎ",ham_inf_3700,49,1,0,0
요즘 날씨 엄청 좋지? 나중에 주말에 바람 쐬러 가고 싶은데 <URL>에서 맛집 추천해줄래? 혹시 전화 <PHONE>로도 연락 해줘 ㅎㅎ,ham_inf_3701,76,1,1,0
"이야~ 다들 모여서 저녁먹자! 여기 맛집 찾아봤어, 메뉴도 괜찮고 재밌는 분위기야! 자세한 건 여기서 확인해봐 <URL>, 그리고 혹시 나한테 전화할 일이 생기면 <PHONE>으로 연락줘~ ㅎㅎ",ham_inf_3702,108,1,1,0
"이번 주말에 영화 보러 가는데 같이 가면 좋겠다, 연락할게 <PHONE>!ㅎㅎ",ham_inf_3703,43,0,1,0
"야, 나 지금 이 영화 예매하려는데 링크 좀 보내줄 수 있어? <URL> 여기서 예매할 수 있대! 아, 그리고 혹시 전화번호도 줄 수 있어? <PHONE> 필요할 것 같아ㅎㅎ",ham_inf_3704,97,1,1,0
"야, 이번 주 토요일에 모임 있을 텐데, 시간 괜찮으면 <PHONE>으로 톡해줘! 상세한 내용은 여길 참고해줘: <URL> 😊",ham_inf_3705,70,1,1,0
"야, 이거 진짜 재밌어! 궁금하면 여기 가서 확인해봐: <URL> ㅋㅋㅋㅋ",ham_inf_3706,41,1,0,0
인스타 사진 올렸는데ㅋㅋ <URL> 링크로 확인해봐~ 너도 저런 분위기 사진 찍어봐! 😊,ham_inf_3707,49,1,0,0
야! 오늘 포스터 디자인 완전 잘 나왔어! <URL>에서 확인해봐~ 그리고 혹시 궁금한 거 있으면 <PHONE>으로 연락 줘! 😊,ham_inf_3708,72,1,1,0
"야, 너 이번 주말에 놀러 올래? 내 번호 <PHONE>으로 톡해줘~ 언제든지 편하게 연락해 ㅎㅎ",ham_inf_3709,54,0,1,0
"야, 이 웹사이트 진짜 괜찮아! 나중에 같이 봐보자~ <URL> 더 궁금한 거 있으면 전화해 <PHONE>ㅋㅋ",ham_inf_3710,61,1,1,0
"야, 이거 너한테 완전 도움 될 것 같아! <URL> 클릭하면 좋은 정보가 가득해! 궁금한 거 있으면 편하게 나한테 전화해 <PHONE>~ ㅎㅎ",ham_inf_3711,80,1,1,0
"이번 주 금요일에 저녁 먹을 건데, 시간 괜찮으면 <PHONE>으로 연락해줘~ 같이 가자! ㅎㅎ",ham_inf_3712,53,0,1,0
이따가 저녁 먹으러 갈 때 <PHONE>으로 연락해줄래? 친구들이 기다리고 있을 거야 ㅎㅎ,ham_inf_3713,50,0,1,0
"이번 주말에 놀러 갈 생각인데, 여기서 더 자세한 정보 확인해봐! <URL> 😊",ham_inf_3714,44,1,0,0
"요즘 바빠서 연락 못 했는데, 다음 주에 한 번 만나자! <PHONE>으로 시간 알려줘~ 😊",ham_inf_3715,51,0,1,0
"어제 영화 보는데 재밌더라, 연락처 남길게 <PHONE> 너도 다음에 보자~ ㅎㅎ",ham_inf_3716,45,0,1,0
"오빠, 이거 진짜 재밌어! <URL>에서 확인해봐~ 같이 보면 좋겠다 ㅎㅎ",ham_inf_3717,41,1,0,0
이번 주말에 나랑 같이 영화 보러 가는 거 어때? 예매는 여기서 할 수 있어! <URL> 기대된다~ 😊,ham_inf_3718,57,1,0,0
"어제 만났던 카페 주소 궁금하네, <PHONE>으로 메시지 좀 보내줄래?ㅎㅎ",ham_inf_3719,42,0,1,0
"어제 친구랑 찍은 사진 올렸는데, 너도 꼭 확인해봐! 여기 링크 있어 <URL> 😊 혹시 궁금한 거 있으면 전화해줘 <PHONE>!",ham_inf_3720,73,1,1,0
혹시 지난 주에 그 맛집 갔던 이야기 기억나? 다음에 또 가면 좋겠다~ 전화번호 알아? <PHONE>으로 바로 예약하면 된다던데 ㅎㅎ,ham_inf_3721,74,0,1,0
"아, 얘! 나 이번에 새로 산 카메라 보여줄게, 전화번호는 <PHONE>이니까 나한테 연락해줘~~ 😊",ham_inf_3722,56,0,1,0
"나 오늘 저녁에 만날까? 근데 메뉴 정하는 것도 어렵네, 여기서 추천 받으면 좋을 듯! <URL> 확인해봐~ 😊",ham_inf_3723,62,1,0,0
"야, 나 어젯밤에 보낸 그 링크(<URL>)에 있는 커피집 진짜 맛있더라! 다음에 너도 가자~ 연락은 <PHONE>으로 해줘! ㅎㅎ",ham_inf_3724,73,1,1,0
"이거 봤어? 요즘 대세라고 하던데, 여기서 확인해봐 <URL> 진짜 재밌어 ㅋㅋ",ham_inf_3725,44,1,0,0
"이번 주말에 영화 보러 갈 건데, 예매하려면 여기 링크 보고 해줘 <URL> 혹시 시간 괜찮아? 😊",ham_inf_3726,55,1,0,0
요즘 뭐하냐? 자주 연락 안 하니까 궁금하네~ 다음주에 한 번 만날래? <PHONE>으로 연락 줘! ㅎㅎ,ham_inf_3727,58,0,1,0
어제 영화 재밌었지? 그리고 내일 만날 때 <PHONE>으로 시간 씩씩하게 알려줘~~ ㅎㅎ,ham_inf_3728,50,0,1,0
"야, 토요일에 나랑 영화 볼래? <PHONE>으로 연락해줘, 시간 맞추자 ㅎㅎ",ham_inf_3729,43,0,1,0
너 이번 주말 계획은 뭐야? 나랑 영화 보러 갈래? 예매는 여기서 할 수 있어! <URL> ㅎㅎ,ham_inf_3730,53,1,0,0
"야, 이번 주말에 놀러 가는 데 조율 좀 하자! 010-1234-5678로 연락해줘~ 😊",ham_inf_3731,49,0,1,0
"야, 나 이거 봤는데 진짜 재밌어! 자세한 건 여기서 확인해봐 <URL>ㅋㅋㅋ 시간 나면 같이 보자~!",ham_inf_3732,57,1,0,0
"야, 우리 이번 주말에 바다 갈 건데, 너도 올래? 자세한 건 여기서 확인해봐~ <URL> 그리고 혹시 궁금한 거 있으면 전화해도 돼! <PHONE> ㅎㅎ",ham_inf_3733,86,1,1,0
"방금 <URL>에서 재밌는 영상 발견했는데, 꼭 봐봐~ 그리고 그 날짜에 <PHONE>으로 연락해줘! 🤣",ham_inf_3734,58,1,1,0
"야, 이 사진 너랑 나 찍은 거 올렸는데 <URL> 한번 봐봐~ 진짜 재밌다 ㅋㅋㅋ",ham_inf_3735,46,1,0,0
"야, 너 그 새로 생긴 카페 가보니까 괜찮더라~ 다음 주에 같이 가자! 주소 보내줄게 <PHONE>ㅎㅎ",ham_inf_3736,57,0,1,0
"야, 이번 주 토요일에 모임 있는데 괜찮으면 <PHONE>으로 연락해줘, 시간 맞춰서 알려줄게! 😊",ham_inf_3737,55,0,1,0
"주말에 뭐 할지 고민 중인데, 재밌는 행사 있으면 여기서 찾아보자! <URL> ㅎㅎ",ham_inf_3738,46,1,0,0
"야, 다음 주에 맛있는 밥 할 건데 <PHONE>으로 간단히 어떤 날이 좋을지 말해줘! ㅎㅎ",ham_inf_3739,51,0,1,0
"이번 주말에 영화 보러 가고 싶은데, 혹시 너의 연락처(<PHONE>)로 시간 괜찮은 거 알려줘~! ㅎㅎ",ham_inf_3740,58,0,1,0
"야, 이번 주말에 놀러 가고 싶은데 여기 정보 봐봐 <URL> 근데 혹시 너도 같이 갈래? ㅎㅎ",ham_inf_3741,53,1,0,0
"이번 주말에 영화 보러 가는데, 여기서 예매 해봐 <URL>! 혹시 같이 갈래? 전화번호도 필요하면 <PHONE>으로 연락해줘~ 😊",ham_inf_3742,73,1,1,0
"주말에 영화 보러 가기로 했는데, 시간 맞춰서 만날 때 <PHONE>으로 연락해줘!ㅎㅎ 기대된다!",ham_inf_3743,54,0,1,0
"야, 나 오늘 저녁에 시간 좀 있어? <PHONE>으로 연락해줘~ 이번 주말에 뭐 할지 얘기해보자 ㅎㅎ",ham_inf_3744,57,0,1,0
어제 그 영화 진짜 재밌더라~ 다음에 같이 보러 갈래? 내 번호는 <PHONE>이야! ㅎㅎ,ham_inf_3745,50,0,1,0
"이번 주 토요일에 친구들이랑 놀러 가는데, 너도 올 거면 <PHONE>으로 연락해줘~ 재밌을 것 같아! 😄",ham_inf_3746,59,0,1,0
"이따가 저녁에 만날 건데, 혹시 시간 바뀌면 <PHONE>으로 연락줘~ 괜찮겠지? ㅎㅎ",ham_inf_3747,48,0,1,0
요즘 너무 바빠서 전화 못했네ㅠ 다음 주에 한번 통화하자! <PHONE>로 연락줘~,ham_inf_3748,46,0,1,0
"야, 오늘 저녁에 한턱 쏴야 할 거 같아! 여기서 다들 올 것 같은데, 자세한 내용은 링크에서 확인해봐 <URL>! 그리고 혹시 참석할 사람 있으면 내 번호로 바로 말해줘 <PHONE>~ㅎㅎ",ham_inf_3749,106,1,1,0
"야, 이따 저녁에 영화 보는데 너도 올래? 뭐 볼지 고민 중인데 <PHONE>으로 문자 줘~~ㅎㅎ",ham_inf_3750,54,0,1,0
"나 이따 6시에 만날 건데, 전화번호 다시 한 번 알려줄래? <PHONE> ㅎㅎ 궁금한 거 있어!",ham_inf_3751,54,0,1,0
"어제 모임에서 이야기한 그 영화 예매하려고 하는데, <PHONE>으로 연락 한번 줘~ ^^",ham_inf_3752,50,0,1,0
"야, 오늘 저녁에 맛있는 치킨 먹으러 가는데, 시간 되면 같이 가자! <PHONE>으로 답장해줘~~~ ㅎㅎ",ham_inf_3753,59,0,1,0
어제 그 영화 진짜 재밌더라! 예고편 보려면 여기(<URL>) 클릭해봐~ ㅋㅋ 너무 감동적이었어!,ham_inf_3754,54,1,0,0
"나 오늘 저녁에 맛있는 치킨 먹으러 가는데, 너도 오면 좋겠다! 자세한 건 여기에 있어 <URL> ㅎㅎ",ham_inf_3755,57,1,0,0
"야, 이따 저녁에 모여서 영화 볼 건데, 혹시 <PHONE>으로 연락해줄래? 나랑 통화하면 더 재밌어질 것 같아 ㅎㅎ",ham_inf_3756,65,0,1,0
어제 말한 그 카페 주소 알아? 여기 있어 <URL>! 다음 주에 같이 가자! 연락은 <PHONE>으로 해~ ㅎㅎ,ham_inf_3757,63,1,1,0
"야, 오늘 저녁 뭐할까? 만약 안 나가면 여기서 <URL>에서 레시피 보고 요리해도 재밌을 것 같아 ㅋㅋ 전화는 <PHONE>으로 해줘!",ham_inf_3758,76,1,1,0
"내가 추천한 그 카페 후기 찾아봤는데, 여기에서 확인할 수 있어! <URL> 한번 가보면 좋겠어~ ㅎㅎ",ham_inf_3759,57,1,0,0
"오늘 저녁에 영화 보러 가는데, 혹시 <PHONE>으로 연락할 수 있어? 너 시간 괜찮으면 같이 가자! 😄",ham_inf_3760,59,0,1,0
"주말에 놀러 갈 건데, 혹시 내 번호로 연락해줘! <PHONE> 이거 잘 바꿔서 보내줘~ ㅎㅎ",ham_inf_3761,52,0,1,0
"야, 나 이번 주말에 사람들 좀 모으려고 하는데, 혹시 <PHONE>으로 연락해줄 수 있어? ㅎㅎ 뭐 먹고 놀지 정해보자~!",ham_inf_3762,69,0,1,0
"요즘 마음이 좀 힘든데, 이 사이트 한번 들어가봐! <URL> 그런 경우에 도움 되는 글들이 많아ㅋㅋ.",ham_inf_3763,57,1,0,0
오늘 영화 보러 가려는데 <PHONE>으로 연락해! 시간 맞춰서 가자 ㅎㅎ,ham_inf_3764,41,0,1,0
"이번 주말에 뭐 할 건데? <PHONE>으로 연락해줘, 우리 같이 놀자 ㅋㅋ",ham_inf_3765,42,0,1,0
"이번 주말에 뭐할지 고민 중인데, 혹시 이거 봤어? <URL> 진짜 재밌어 보인다~💕",ham_inf_3766,47,1,0,0
"야, 이번에 같이 영화 보러 가자! ㅋ 시간 되면 <PHONE>으로 연락줘~",ham_inf_3767,42,0,1,0
이번 주말에 가는 그 전시회 포스터 여기 있어~ <URL> 같이 가면 재밌겠다! ㅎㅎ,ham_inf_3768,47,1,0,0
"어제 영화 본 이야기 나중에 해주고, 궁금하면 이 링크에서 보던데 <URL> 확인해봐~ 그리고 우리 요즘 자주 연락하자, 전화번호는 <PHONE>이야~ 😊",ham_inf_3769,86,1,1,0
이번 주말에 나랑 영화 보러 갈래? <PHONE>으로 시간 맞춰서 연락해줘! ㅎㅎ,ham_inf_3770,45,0,1,0
"야, 요즘 바쁘지? 이거 진짜 재밌으니까 한번 봐봐! <URL> 그리고 전화로도 얘기 좀 하자~ <PHONE>",ham_inf_3771,61,1,1,0
"너 지난주에 만났던 그 카페 너무 좋았지? 나중에 또 가고 싶다, 주소 여기 있어: <URL> 근데 전화번호도 있더라, 혹시 궁금하면 <PHONE>에 문의해봐 ㅎㅎ",ham_inf_3772,91,1,1,0
이번 주말에 영화 보러 가는데 <PHONE>으로 간다고 하니까 혹시 같이 갈래? ㅎㅎ,ham_inf_3773,47,0,1,0
"요즘 자주 가는 카페인데, 여기 진짜 꿀맛이야~ 😍 <URL> 한번 가봐! 전화번호도 공유할게 <PHONE>, 예약해 보면 좋을 듯!",ham_inf_3774,74,1,1,0
"내가 새로 간 카페 진짜 맛있더라! 다음에 같이 가자, <PHONE>으로 연락해~ ㅎㅎ",ham_inf_3775,48,0,1,0
"야, 이따 저녁에 만날 건데 <PHONE>으로 시간 좀 알려줘! 궁금해~~ 😊",ham_inf_3776,43,0,1,0
"야~ 이번 주말에 계획 없어? <URL>에서 할인 쿠폰도 확인했으니, 꼭 가봐야 할 것 같아! 연락해줘~ <PHONE>",ham_inf_3777,66,1,1,0
요즘 너무 힘들어서 그런지 마음이 그렇네ㅠㅠ 이거 보면서 쉴 겸 해봐 <URL> 나도 같이 확인해볼래!,ham_inf_3778,57,1,0,0
내일 그 카페 가자! <PHONE>으로 시간 알려줘~ 😊,ham_inf_3779,31,0,1,0
근데 혹시 이거 보셨어? <URL> 완전 재밌는데 같이 보면 좋을 것 같아ㅎㅎ,ham_inf_3780,43,1,0,0
"야, 오늘 저녁에 개봉한 영화 보러 갈 건데 같이 갈래? 내 번호는 <PHONE>이야, 문자 줘~~~! ㅎㅎ",ham_inf_3781,60,0,1,0
"요즘 너무 바빠서 시간 없는데, <URL>에서 예약도 하고 기다려야 하는데 어떡하지? 😅",ham_inf_3782,49,1,0,0
"어제 저녁에 전화번호 <PHONE>으로 연락했는데, 잘 알아보셨어? 맛있는 거 공유하니까 기대해도 돼! ㅎㅎ",ham_inf_3783,60,0,1,0
"나 요즘 이거 온라인으로 샀는데 진짜 대박이야, 너도 한번 확인해봐! 여기 링크야 <URL> ㅎㅎ",ham_inf_3784,54,1,0,0
"야, 이번 주말에 시간 괜찮으면 여기 가서 맛있는 저녁 먹자! <URL>에서 예약해놓을게, 전화는 <PHONE>으로 해줘ㅎㅎ",ham_inf_3785,69,1,1,0
"야, 이번 주 토요일에 모임 있는데, <PHONE>으로 확인해줘! 나 잊지 말고 꼭 연락해~~~ 😊",ham_inf_3786,55,0,1,0
"요즘 너무 바빠서 못 본 것 같은데, 이따 시간 나면 <URL> 이거 보면서 통화 좀 해줘~ <PHONE> 번호로 연락할게! ㅎㅎ",ham_inf_3787,72,1,1,0
"이번 주 토요일에 만날 때 <PHONE>으로 연락해줘, 시간 조정해야 할 것 같아! ㅎㅎ",ham_inf_3788,49,0,1,0
"야, 나 오늘 늦게 퇴근하는데 혹시 <PHONE>으로 전화해줄 수 있어? 너랑 얘기하고 싶은 게 많아 ㅎㅎ",ham_inf_3789,59,0,1,0
"야~ 나 이번 주말에 갑자기 시간이 생겼는데, 뭐 할까? 혹시 <URL>에서 맛집 검색해줄래? 그리고 전화번호는 <PHONE>이야, 궁금한 거 있으면 언제든지 연락해! 😄",ham_inf_3790,95,1,1,0
주말에 영화 보러 가고 싶은데 여기서 예매해도 괜찮아! <URL> 확인해줘~ㅎㅎ,ham_inf_3791,44,1,0,0
우리 이번 주말에 나랑 영화 보러 갈래? <PHONE>으로 연락해줘~ ㅎㅎ 기대된다!,ham_inf_3792,47,0,1,0
"어제 가봤는데 그 카페 진짜 예쁘던데! 나중에 <URL> 확인해보고 전화번호는 <PHONE> 이래, 꼭 한 번 가보자~ 😊",ham_inf_3793,68,1,1,0
어제 너랑 이야기한 그 카페 주소 찾아봤더니 <URL> 여기야! 이따가 같이 가서 맛있는 거 먹으러 가자~ 😊 궁금한 거 있으면 나한테 전화해줘 <PHONE>!,ham_inf_3794,89,1,1,0
이거 진짜 재미있으니까 꼭 한 번 해봐! 자세한 건 여기에서 확인해줘 <URL>ㅎㅎ,ham_inf_3795,46,1,0,0
"오랜만에 만나는 거니까 저녁에 맛있는 거 먹자~ 같이 가자, 내 번호는 <PHONE>이야! ㅎㅎ",ham_inf_3796,53,0,1,0
"이번 주말에 놀러 가는데, 혹시 시간 괜찮으면 <PHONE>으로 연락줘서 같이 가자! ㅎㅎ",ham_inf_3797,50,0,1,0
"요즘 뭐 해? 나 새로 구입한 카페에서 이렇게 예쁜 케이크 먹었어! 후기 보고 싶으면 여기 링크 봐 <URL>, 사진도 많이 찍었으니까 같이 감상해 봐~ 아 그리고, 이 카페 전화번호도 알려줄게! <PHONE> 응? 언제 한 번 같이 가자~ ㅎㅎ",ham_inf_3798,137,1,1,0
"어제 갔던 카페 너무 좋았어! 다음에 같이 가자, 여긴 <URL>에서 찾아볼 수 있어~ 그리고 혹시 나중에 전화 <PHONE> 한 번 해줘! ㅎㅎ",ham_inf_3799,81,1,1,0
"이번 주말에 가려고 하는 카페인데, 여기 분위기 진짜 예뻐서 한 번 가봐! <URL> 보고 나랑 같이 가볼래? 😊",ham_inf_3800,63,1,0,0
"아, 나중에 저녁 먹으러 가자 그럼 <PHONE>으로 시간 맞추자~~ 너무 기대된다 ㅎㅎ!",ham_inf_3801,50,0,1,0
"이번 주말에 놀러 가고 싶은데, 여기 좋은 장소가 있더라구! <URL>에서 확인해 보고, 전화는 <PHONE>으로 해줘~ 같이 가자! 😊",ham_inf_3802,76,1,1,0
"야, 우리 언제 한번 놀러가자! 전화번호 <PHONE>으로 연락해줘~ 어디가면 좋을까? ㅎㅎ",ham_inf_3803,51,0,1,0
"요즘 나랑 비슷한 거 찾고 있는데, 이거 진짜 괜찮더라! 확인해봐 <URL> ㅎㅎ",ham_inf_3804,45,1,0,0
"이따가 영화 보러 가는데, 시간 맞춰서 <PHONE>으로 톡해줘~ 재밌는 거 보고 싶어 ㅎㅎ",ham_inf_3805,51,0,1,0
"야, 내일 영화 보러 가려고 하는데 혹시 <PHONE>으로 시간 맞춰줄 수 있어? ㅋㅋ 함께하면 재밌겠는데! 🎬✨",ham_inf_3806,63,0,1,0
"야, 이번 주말에 같이 영화 보러 갈 건데 예매하셨으면 좋겠어! 여기 링크야 <URL> 궁금한 거 있으면 여기에 전화해봐 <PHONE> ㅎㅎ",ham_inf_3807,78,1,1,0
"어제 모임 재밌었지? 다음엔 꼭 연락해, 내 번호는 <PHONE>이야! 😄",ham_inf_3808,41,0,1,0
"어제 그 영화 진짜 재밌었어! 예고편 여기서 볼 수 있어 <URL>, 다음에 같이 보러 가자~ 전화번호 바꿨는데, 혹시 내 번호 저장해놨지? <PHONE> ㅎㅎ",ham_inf_3809,89,1,1,0
"야, 이거 진짜 대박인데 <URL> 보니까 너도 관심 있을 것 같아서 보내! 놀러 가자~ <PHONE>으로 연락해줘! 😊✨",ham_inf_3810,68,1,1,0
"에이~ 그 영화 재밌는 것 같던데, 예고편 보고 싶으면 여기서 확인해봐 <URL> ㅎㅎ",ham_inf_3811,48,1,0,0
"야, 다음 주에 만날 때 <PHONE>으로 카톡해줘, 시간 맞추기 귀찮아서~ ㅎㅎ",ham_inf_3812,45,0,1,0
"요즘 예쁜 카페 많이 다니는데, 이거 진짜 추천해! 여기 링크로 가면 자세한 정보 있어 <URL> 혹시 전화번호도 필요하면 <PHONE>으로 연락해봐! ㅎㅎ",ham_inf_3813,87,1,1,0
"야, 나 어제 재미있는 영상 봤는데 이거 꼭 확인해봐! <URL> 같은 거 진짜 웃겨 ㅋㅋ",ham_inf_3814,50,1,0,0
"너 오늘 저녁에 시간 있어? 나랑 같이 영화 보러 가고 싶은데, <PHONE>으로 답장해줘~ㅎㅎ",ham_inf_3815,53,0,1,0
"오늘 저녁에 맛있는 거 먹고 싶은데, <PHONE>으로 연락해 줘! 뭐 먹을지 같이 정하자~ 😄",ham_inf_3816,53,0,1,0
"야, 나 오늘 저녁에 저녁 먹으러 갈 건데 같이 갈래? <PHONE>으로 답해줘! ㅎㅎ",ham_inf_3817,48,0,1,0
너 요즘 잘 지내? 지난번에 보낸 카페 전화번호 혹시 잊었으면 <PHONE>으로 연락해! ㅋㅋ 나도 다시 가고 싶다~ 😊,ham_inf_3818,67,0,1,0
"너 오늘 저녁에 시간 괜찮아? 만약 괜찮으면 <PHONE>으로 연락해줘, 같이 맛있는 거 먹으러 가자! ㅎㅎ",ham_inf_3819,60,0,1,0
"여기 요즘 인기 있는 맛집이야! 나도 가보고 싶었는데, <URL>에서 리뷰 봤어. 같이 가면 재밌겠다 ㅎㅎ",ham_inf_3820,59,1,0,0
어제 본 영화 진짜 재밌었어! 요기서 예고편 봤어 <URL> 진짜 추천해 ㅎㅎ,ham_inf_3821,43,1,0,0
"요즘 너무 바빠서 카페 못 가봤네, 근데 여기 진짜 맛있더라! 한 번 가봐 <URL> ㅎㅎ",ham_inf_3822,50,1,0,0
"야, 너 그 영화 예매했어? <PHONE>으로 연락 주면 내가 같이 가줄게~ ㅋㅋ",ham_inf_3823,45,0,1,0
"야, 오늘 저녁에 만나서 영화 볼 건데, 이 링크 확인해봐! <URL> 그리고 너 그때 연락할게, 내 번호는 <PHONE>야! ㅎㅎ 기대된다~",ham_inf_3824,79,1,1,0
주말에 놀러 갈 데 있는지 여기 보고 해봐 <URL>! 넘 재밌겠던데 ㅎㅎ,ham_inf_3825,41,1,0,0
야! 어제 말한 카페 여기 링크 있어 <URL> 너도 한번 가봐~~ 정말 맛있었어! 🍰✨,ham_inf_3826,49,1,0,0
"요즘 재밌는 영상들 많던데, 여기 좋은 거 하나 발견했어! <URL> 나도 한번 봐봐~ ㅋㅋ",ham_inf_3827,51,1,0,0
"이따가 저녁 먹고 싶으면 여기서 주문해줘~ <URL> 가게 정보 봐봐! 전화번호는 <PHONE>이야, 너도 한번 해보면 좋을 듯! 😊",ham_inf_3828,74,1,1,0
"야, 그 영화 진짜 재밌더라! 나도 좀 더 보고 싶어서 <URL> 들어가 봤는데, 예매는 <PHONE>으로 했어~ 너도 지금 확인해봐! 😄",ham_inf_3829,77,1,1,0
"야, 오늘 저녁에 영화 보러 가는데 너도 올래? 시간 맞춰서 7시까지 <PHONE>으로 연락 줘~! ㅎㅎ",ham_inf_3830,58,0,1,0
"나 오늘 친구한테 <URL> 소개해줬는데, 완전 재밌더라 ㅋㅋ 시간 되면 같이 보자! 그리고 혹시 <PHONE>으로 연락해줄 수 있어?",ham_inf_3831,75,1,1,0
"이번 주말에 영화 보러 가는데, 넌 같이 갈래? 내가 예매했으니까 <PHONE>으로 연락줘~ 😊",ham_inf_3832,53,0,1,0
"야, 오늘 저녁에 뭐 먹을지 고민 중인데, 혹시 <PHONE>으로 연락 좀 해줄래? ㅎㅎ 너의 추천이 필요해!",ham_inf_3833,61,0,1,0
"이번 주말에 시간이 되면 여기 가보자! 정말 맛있던데, 링크는 <URL>야~ 그리고 전화번호는 <PHONE>이니깐 궁금하면 물어봐! ㅎㅎ",ham_inf_3834,76,1,1,0
"너 극장에서 하는 영화 예매했는데, 여기 링크 보고 확인해봐 <URL>, 혹시 시간 맞으면 같이 보러 가자! 연락은 <PHONE>으로 줘ㅎㅎ",ham_inf_3835,78,1,1,0
"나 오늘 점심 뭐 먹지? <URL> 여기 맛집 추천해줄게, 전화는 <PHONE>으로 해보면 좋을듯 ㅎㅎ",ham_inf_3836,57,1,1,0
"어제 영화 너무 재밌었네! 다음에는 같이 보자, <PHONE>으로 연락해줘~ ㅎㅎ",ham_inf_3837,45,0,1,0
"야, 이번 주 토요일에 모임 있는데, 자세한 건 여기 확인해봐 <URL>! 뭘 가져갈지 고민 중인데, 너도 같이 가자~ <PHONE>로 연락 줘! 😊",ham_inf_3838,83,1,1,0
이번 주말에 볼 영화 예고편 여기서 확인해봐~ <URL>  분위기 진짜 기대돼! 😄,ham_inf_3839,46,1,0,0
"어제 갔던 카페 진짜 좋았어! 맛있는 사진 다 찍었는데, 더 궁금하면 여기 봐봐 :) <URL>",ham_inf_3840,53,1,0,0
"요즘 진짜 재미있는 웹툰 찾았는데, 여기 링크로 들어가면 더 볼 수 있어! <URL> 완전 추천해 ㅎㅎ",ham_inf_3841,57,1,0,0
"야! 오늘 저녁 뭐 할 거야? 옛날 맛있던 떡볶이에 가고 싶은데, 여기 <URL> 확인하고 같이 가자~ 혹시 전화해야 하면 <PHONE>으로 연락 줘! ㅎㅎ",ham_inf_3842,87,1,1,0
"이거 귀찮아 또 모임 준비해야 되는데, 자세한 건 여기 <URL> 보고, 혹시 전화라도 필요하면 <PHONE>으로 연락해줘~ㅎㅎ",ham_inf_3843,71,1,1,0
"야, 저번에 얘기했던 그 맛집 웹사이트 찾았어! 여기 링크 보내줄게 <URL> 꼭 가봐~ 맛있어 보이는 메뉴도 많고! ㅎㅎ",ham_inf_3844,68,1,0,0
"요즘 너무 지루한데, 예전에 갔던 카페 사진 보니까 다시 가고 싶더라~ <URL> 한번 가보자! 전화번호도 잊어버렸네, <PHONE>으로 확인해줄래? ㅎㅎ",ham_inf_3845,86,1,1,0
"이제 곧 회식인데, 오랜만에 만나서 다같이 모인다는 거 생각하니까 너무 설렌다 ㅎㅎ 장소는 여기에서 확인해봐~ <URL> 그리고 혹시 늦으면 나한테 <PHONE>으로 연락해줘!",ham_inf_3846,98,1,1,0
"이제 우리 그 카페 가야겠다! <URL>에서 예약했는데, 자세한 건 여기서 확인해봐~ 혹시 너 그때 시간 괜찮아? <PHONE>으로 연락줘! 😊",ham_inf_3847,80,1,1,0
