text,id,length,has_url,has_phone,label
"야, 너랑 주말에 영화 보러 가고 싶은데, 연락은 <PHONE>으로 해줘~ㅎㅎ 시간 맞춰서 조정하자!",ham_inf_1170,56,0,1,0
"이번 주말에 영화 보러 가겠다고 했잖아! <PHONE>으로 연락해줘, 시간 조정할게ㅎㅎ",ham_inf_1171,48,0,1,0
아! 이번 주 토요일에 뭐 하냐? 시간 되면 <PHONE>으로 연락해줘~ 나랑 카페에서 수다 떨고 싶어! 😊,ham_inf_1172,60,0,1,0
"야, 이거 진짜 재밌어! 나 어제 <URL>에서 봤는데, 너도 꼭 확인해봐~ 궁금한 거 있으면 <PHONE>으로 전화해줘! ㅋㅋ",ham_inf_1173,71,1,1,0
요즘 너무 바쁘다 ㅠㅠ 저녁 먹고 싶으면 <PHONE>으로 문자해줘~ 시간 맞춰서 한잔하자!,ham_inf_1174,51,0,1,0
오늘 라이브 공연 가는데 전화번호 혹시 <PHONE>에서 확인할 수 있을까? 진짜 기대돼 ㅎㅎ,ham_inf_1175,52,0,1,0
주말에 시간 돼? 내가 찾은 맛집 정보 여기서 봐 <URL> ㅎㅎ 같이 가자!,ham_inf_1176,43,1,0,0
"요즘 재밌는 영상 찾느라 헤맸는데, 여기 진짜 꿀잼 영상 있어!! 꼭 봐봐~ <URL> ㅋㅋ",ham_inf_1177,51,1,0,0
"야, 나 이따 <PHONE>으로 전화할게! 궁금한 거 있어서 ㅋㅋ 잠깐 얘기하자~",ham_inf_1178,45,0,1,0
"이번에 새로 온 카페 메뉴 진짜 맛있어 보여, 여기 링크 한번 보세요~ <URL> 나도 꼭 가봐야겠어! 😊",ham_inf_1179,59,1,0,0
이 주말에 시간 되면 같이 영화 보러 가자! 예매는 여기서 할 수 있어~ <URL> 그리고 저녁은 <PHONE>으로 연락 한 뒤에 결정하자! 😊,ham_inf_1180,80,1,1,0
"야, 나 오늘 맛있는 떡볶이집 발견했어! 주소는 여기야 <URL> 궁금하면 같이 가자~~ 전화는 <PHONE>으로 하면 돼! ㅎㅎ",ham_inf_1181,72,1,1,0
요즘 나 무슨 일인지 우울해서... 이 사이트 좀 들어가볼래? <URL> 여기서 위로 받을 수 있을 것 같아 ㅎㅎ,ham_inf_1182,63,1,0,0
"야, 내일 3시에 영화 보러 가는데 같이 갈래? 전화해줘 <PHONE>!! ㅎㅎ",ham_inf_1183,44,0,1,0
"야, 이번 주말에 영화 보러 가기로 한 거 기억하지? <URL> 거기서 예매하니까 확인해봐~ 그리고 너 전화번호도 쪼금 보내줘 <PHONE> ㅋㅋ",ham_inf_1184,81,1,1,0
"야, 그거 기억나? 지난번에 졸업앨범 보면서 고백하려던 얘기! <PHONE>으로 한번 연락해봐, 그때 같이 이야기해보고 싶어~~ 😊",ham_inf_1185,73,0,1,0
"주말에 같이 놀러 가고 싶은데, 여기서 하나 든든한 맛집 리스트 찾았어! 확인해봐~ <URL>",ham_inf_1186,52,1,0,0
"이번 주 토요일에 영화 보러 가는데, 혹시 <PHONE>으로 시간 맞춰서 얘기할래? 넷플릭스보다 재밌을 거 같아! 😄",ham_inf_1187,65,0,1,0
"야, 다음 주에 그 모임 있을 때 <PHONE>에 문자 하나 줘~ 꼭 보자! ㅎㅎ",ham_inf_1188,45,0,1,0
"야, 이번 주말에 저녁 같이 먹자! 장소는 여기가 좋을 것 같아 <URL> 근데 언제가 좋을지, 내가 <PHONE>으로 문자해볼게! ㅎㅎ",ham_inf_1189,76,1,1,0
"어제 저녁에 얘기한 그 영화 예매하려고 하는데, 혹시 <PHONE>으로 내가 알려준 시간 기억해? ㅎㅎ",ham_inf_1190,57,0,1,0
"야, 너 그 맛집 후기 봤어? 여기 링크 보니까 진짜 맛있어 보여! <URL> 같이 가자~ ㅋㅋ",ham_inf_1191,53,1,0,0
"야, 이번 주말에 뭐해? <PHONE>으로 연락해줘~ 같이 놀러 가자!! ㅎㅎ",ham_inf_1192,43,0,1,0
"이제 곧 만날 건데, 너가 좋아하는 카페 주소 보내줄게~ 여기야! <URL> 그리고 내 번호도 다시 말해줄게! <PHONE> 문자해줘~~ 😊",ham_inf_1193,78,1,1,0
오늘 저녁에 먹을 치킨 어떤 게 좋냐~? 너도 주문할 거면 <PHONE>으로 알려줘! ㅎㅎ,ham_inf_1194,50,0,1,0
"요즘 진짜 핫한 맛집 발견했는데, 여기 링크 확인해봐! <URL> 그리고 다음 주 주말에 같이 가자, 전화번호는 <PHONE>이야! 😆",ham_inf_1195,75,1,1,0
"이번 주 토요일에 영화 보러가는데 시간 괜찮으면 <PHONE>로 연락해 줘, 같이 가자~ 😊",ham_inf_1196,51,0,1,0
"이따가 저녁에 뭐 먹을지 고민 중인데, 혹시 <PHONE>으로 메뉴 추천 좀 해줘! 😊",ham_inf_1197,48,0,1,0
"요즘 영화 재미있다고 하는데, <URL> 여기서 예고편 봤어? 다음 주말에 같이 보러 가자~ <PHONE>으로 연락 줘! 😄",ham_inf_1198,69,1,1,0
"어제 저녁 너무 재밌었어! 다음에 또 모이자~ㅎㅎ 그리고 사진은 여기서 확인해봐, <URL> 나중에 더 얘기하고 싶으면 전화해줘 <PHONE>!",ham_inf_1199,80,1,1,0
"안녕! 내일 저녁에 만나려고 하는데, 혹시 <PHONE>으로 연락해줄 수 있어? ㅋㅋ",ham_inf_1200,47,0,1,0
어제 본 영화 너무 재밌었어! 예고편도 여기서 확인해봐 <URL> 😊,ham_inf_1201,38,1,0,0
"야, 오늘 저녁에 뭐하냐? 시간 괜찮으면 나랑 같이 영화 보러 가자~ 문자로 답장해줘 <PHONE>! ㅋㅋ",ham_inf_1202,59,0,1,0
이번 주 토요일에 시간 괜찮으면 같이 갈래? 근데 미리 계획 세우려면 <PHONE>으로 연락해줘야 할 것 같아! 😊,ham_inf_1203,64,0,1,0
"아, 이번 주 토요일에 모임 있는데, 시간 괜찮으면 <PHONE>으로 연락 줘! 재밌는 이야기 많이 해보자 ㅋㅋ",ham_inf_1204,62,0,1,0
"야, 오늘 저녁에 뭐 먹을래? 이거 보고 정해줘! <URL> ㅎㅎ",ham_inf_1205,36,1,0,0
"어제 카페에서 만난 그 음식점 추천받았는데, 여기 링크 한번 봐봐! <URL> 진짜 맛있어 보여 ㅎㅎ",ham_inf_1206,56,1,0,0
"어제 너무 재밌었지? 다음에 또 만나려고 하는데, 시간 맞춰서 <PHONE>으로 연락해줘~ 그리고 여기서 사진도 확인해봐! <URL> ㅎㅎ",ham_inf_1207,77,1,1,0
이번 주 토요일에 약속 잡았던 거 기억해? 그때 <PHONE>으로 연락하자~ ㅎㅎ 기대된다!,ham_inf_1208,51,0,1,0
이번 주말에 가는 그 카페 좋더라! 주소는 여기야 <URL> 나중에 전화도 해봐야겠다 <PHONE> ㅎㅎ,ham_inf_1209,58,1,1,0
이번 주말에 신상 카페 가려는데 같이 갈래? 전화번호는 <PHONE>으로 몇 시에 만날지 말해줘! 😊,ham_inf_1210,56,0,1,0
"어제 새로 사귄 친구가 연락처 달라고 해서 <PHONE> 넘겼어, ㅋㅋ 신기하게도 서울에 자주 간다네!",ham_inf_1211,57,0,1,0
"주말에 놀러 갈 건데, 이 해변 좋더라! <URL>에서 자세한 정보 확인해봐! ㅎㅎ",ham_inf_1212,46,1,0,0
"내일 친구들이랑 모임하는데, <PHONE>으로 연락해줘~ 뭘 먹을지 상의하자! ㅎㅎ",ham_inf_1213,46,0,1,0
"이번에 간단한 여행 계획 세웠는데, 여기에 자세한 정보가 있어 <URL> 한번 확인해봐! 너무 재밌을 것 같아ㅎㅎ",ham_inf_1214,63,1,0,0
지난주에 보낸 그 링크(t.co/abc123) 다시 확인해 볼래? 궁금한 거 있으믄 <PHONE>으로 연락해줘~ 😄,ham_inf_1215,64,1,1,0
이번 주말에 모임 있으니까 <PHONE>으로 자세한 이야기해보자! 기대된다~ ㅎㅎ,ham_inf_1216,45,0,1,0
이번 주말에 그 전시회 가고 싶으면 여기 링크 확인해봐요! <URL> 재밌을 것 같아ㅎㅎ,ham_inf_1217,49,1,0,0
"야, 저번에 말했던 이벤트 링크 보니까 진짜 재밌을 것 같아! 확인해봐 <URL>, 궁금한 점 있으면 연락해~ <PHONE>ㅎㅎ",ham_inf_1218,71,1,1,0
"야, 이번 주말에 재밌는 공연 있어! 여기에 자세한 정보랑 티켓 링크가 있어 <URL> 꼭 한 번 보렴~ 😊",ham_inf_1219,60,1,0,0
이따가 저녁 먹으러 같이 갈래? 기대돼! 메뉴는 여기 링크에서 확인해봐 <URL> 그리고 오늘 몇 시에 만날지 알려줘 <PHONE>~!,ham_inf_1220,75,1,1,0
"야, 너랑 내가 예전에 얘기한 영화 보러 가는 거 너무 신난다! 근데 시간이 좀 애매해서 <PHONE>으로 한 번 연락해봐야겠다ㅎㅎ",ham_inf_1221,73,0,1,0
"야, 혹시 그 영화 예매했어? <PHONE>으로 연락해줘~ 아직 티켓 남아있으면 나도 같이 가고 싶어! 😄",ham_inf_1222,59,0,1,0
"오늘 만나서 막걸리 마실건데, 010-1234-5678에 연락줘~ 시간이 언제든 괜찮아! ㅎㅎ",ham_inf_1223,52,0,1,0
"나 오늘 저녁에 만나려고 하는데, 혹시 시간 괜찮아? 전화나 문자로 연락해줘 <PHONE>, 그리고 저기 가는 길 알려줄게 <URL> 😄",ham_inf_1224,76,1,1,0
"이번 주말에 영화 보러 가자! 예매는 여기서 할 수 있어 <URL>, 근데 나한테 문자로 다시 알려줘 <PHONE> ㅎㅎ",ham_inf_1225,67,1,1,0
"야, 내가 앞으로 <PHONE>으로 연락할게! 혹시 너랑 영화 보는데 언제 시간이 좋을까? ㅎㅎ",ham_inf_1226,53,0,1,0
주말에 진짜 재밌는 영화 발견했어! 예고편 여기서 확인해봐 <URL> ㅎㅎ 같이 보러 가자~,ham_inf_1227,51,1,0,0
"야, 요즘 너무 심심한데, 이번 주말에 놀러 가자! 재밌는 거 발견하면 여기에 링크 보낼게! <URL> 그리고 전화번호도 알아야지! <PHONE> ㅋㅋㅋ 잊지 말고 연락해~✨",ham_inf_1228,97,1,1,0
"너, 이번 주말에 뭐해? 근데 너 그 <PHONE>으로 연락해줘, 같이 영화 보러가자~ ㅎㅎ",ham_inf_1229,51,0,1,0
"나 오늘 친구랑 갈만한 카페 찾다가 여기 사이트 봤는데, 분위기 진짜 좋더라 😍 <URL> 한번 확인해봐!",ham_inf_1230,59,1,0,0
"요즘 그 카페에서 할인 이벤트 하던데, 여기 링크 가져왔어~ <URL> 같이 가자! ㅎㅎ",ham_inf_1231,49,1,0,0
"야, 이 카페 진짜 강추인데 <URL>에서 쿠폰도 받을 수 있어! 혹시 시간 되면 같이 가자~ <PHONE>으로 연락해줘! ㅎㅎ",ham_inf_1232,71,1,1,0
내가 찾던 카페 정보를 여기서 발견했어! 여길 참고해봐 <URL> 진짜 대박이야ㅎㅎ,ham_inf_1233,46,1,0,0
내가 찾은 요리 레시피 사이트인데 진짜 맛있어 보여! 한번 들어가서 확인해봐 <URL> ㅎㅎ,ham_inf_1234,51,1,0,0
그럼 주말에 시간 되면 이 링크 확인해봐 <URL> 혹시 궁금한 거 있으면 전화해줘 <PHONE>ㅎㅎ!,ham_inf_1235,57,1,1,0
"야, 내가 이번에 재밌는 데 가볼까 하는데, 여기 <URL>에서 더 알아봐! 혹시 시간 되면 같이 가자! 😄 전화는 <PHONE>으로 해줘~",ham_inf_1236,78,1,1,0
"야, 이번 주말에 바다 가려고 하는데, 여기서 숙소 예약했어! 자세한 건 여기 보고 <URL> 확인해봐! 궁금한 거 있으면 이 번호로 문자 줘 <PHONE> 😊",ham_inf_1237,89,1,1,0
야~ 너 저기 <URL> 봤어? 언제 시간 괜찮아? 전화 <PHONE>로 한 번 연락해봐! ㅎㅎ,ham_inf_1238,53,1,1,0
"야, 내일 날씨 개좋대! 궁금하면 여기 가서 확인해봐 <URL> 그리고 혹시 시간 되면 저녁에 전화 좀 해줘 <PHONE>ㅎㅎ",ham_inf_1239,70,1,1,0
"야, 이번 주말에 저기 <URL> 가면 좋은 전시 한다던데, 시간 내서 같이 가자~! ㅎㅎ",ham_inf_1240,50,1,0,0
"요즘 핫한 카페 정보 찾았어! 여기 링크 보고 가봐 <URL>, 궁금한 점 있으면 전화해줘 <PHONE>~ ㅎㅎ",ham_inf_1241,62,1,1,0
이번 주말에 시간 괜찮으면 <PHONE>으로 연락 줘! 같이 놀자 ㅎㅎ,ham_inf_1242,39,0,1,0
"요즘 너무 바쁜데, 시간 내서 <PHONE>으로 연락해 줘! 한 번 얼굴 보고 싶다 ㅎㅎ",ham_inf_1243,49,0,1,0
"어제 너랑도 얘기했던 그 영화, 바로 예고편 링크 보내줄게! 근데 진짜로 전화번호도 바꿨더라고 <PHONE> 나중에 다시 연락해~ ㅎㅎ",ham_inf_1244,75,0,1,0
"어제 말한 그 영화 예매할건데, 링크 여기서 확인해봐! <URL> 그리고 혹시 보러 갈 사람 더 있으면 말해줘~ <PHONE>으로도 연락해줘! 😊",ham_inf_1245,81,1,1,0
"이번 주말에 계획 잡아야 하는데, 재미있는 논문 기사 봤는데 링크가 <URL>야! 한번 읽어봐~ 😊",ham_inf_1246,55,1,0,0
"요즘 연락 너무 없었는데, 오랜만에 잘 지내지? 혹시 연락처 바뀌었으면 <PHONE> 번호로 나한테 문자 줘! 😄✨",ham_inf_1247,64,0,1,0
"야, 너 혹시 내가 보낸 링크 <URL>에서 그 맛집 확인했어? 진짜 맛있더라, 다음에 같이 가자! 😋 그리고 이 번호로 연락해줘 <PHONE>!",ham_inf_1248,81,1,1,0
"요즘 여기 진짜 재밌는 이벤트하는데, 자세한 건 여기서 확인해봐! <URL> 너도 한번 가보면 좋을 것 같아~ ㅎㅎ",ham_inf_1249,64,1,0,0
"야, 나 이거 진짜 재밌는 사이트 찾았어! 같이 보면 좋을 듯 <URL> ㅎㅎ 꼭 가봐!",ham_inf_1250,49,1,0,0
"오늘 저녁에 영화 보려고 하는데, 너도 같이 올래? <PHONE>으로 답장해줘~ ㅎㅎ",ham_inf_1251,47,0,1,0
"이번 주말에 갔던 카페 사진 여기 있어! <URL> 한번 봐봐, 진짜 분위기 끝내줌 😊",ham_inf_1252,48,1,0,0
오늘 저녁에 영화 보러 가기로 했어! 예매는 여기서 하면 돼: <URL> 시간 맞춰서 만나자~ 😊,ham_inf_1253,54,1,0,0
이거 정말 재밌어 보여! 여기 링크 한번 봐봐 <URL> ㅋㅋ 나도 곧 염두에 두고 있어~,ham_inf_1254,50,1,0,0
"이번 주말에 바다 갈 건데, 같이 가고 싶으면 이 링크 보고 알려줘! <URL>ㅎㅎ",ham_inf_1255,46,1,0,0
"야, 오늘 저녁 뭐 먹을지 고민인데, 혹시 <PHONE>으로 문자 좀 보내줄래? 뭘 먹을지 같이 고민해보자 ㅋㅋ",ham_inf_1256,62,0,1,0
"나 오늘 늦잠 자서 약속시간 무조건 늦을 것 같아, <PHONE>으로 연락해줘~ ㅠㅠ",ham_inf_1257,47,0,1,0
요즘 어떻게 지내? 다음 주에 시간 괜찮으면 같이 영화 보러 가자! <PHONE>으로 연락해줘~~ 😄,ham_inf_1258,56,0,1,0
"야, 저번에 말한 그 카페 너무 좋더라! 여긴 <URL> 있어, 다음에 같이 가자~ ☕️✨",ham_inf_1259,50,1,0,0
"오늘 저녁에 맛있는 거 먹으러 가는데, 혹시 시간 될까? <PHONE>으로 연락줘! 그리고 이 카페 진짜 맛있더라, 여기 <URL>에서 확인해봐! 🍰✨",ham_inf_1260,84,1,1,0
"야, 이번 주말에 너랑 영화 보러 가고 싶은데, 시간 괜찮아? <PHONE>으로 연락 줘~ ㅎㅎ",ham_inf_1261,53,0,1,0
"요즘 너무 바쁘지? 저녁때 한 번 이야기하자, <PHONE>로 시간 맞춰줘~ ㅎㅎ",ham_inf_1262,45,0,1,0
이런 좋은 정보가 있네! 여기 링크 좀 클릭해봐~ <URL> 정말 유용할 거 같아! ㅎㅎ,ham_inf_1263,49,1,0,0
"내일 저녁에 모임 있는데, <PHONE>으로 시간 맞춰줘! 기대되네요~ 😊",ham_inf_1264,41,0,1,0
"너 지금 뭐 해? 시간이 되면 <PHONE>으로 연락해줘, 요즘 너무久만이라서ㅎㅎ 만나서 맥주 한 잔 하고 싶어!",ham_inf_1265,63,0,1,0
"지금 전화해줘, <PHONE>으로 연락하면 돼! 너무 궁금한 일이 생겼어 ㅎㅎ",ham_inf_1266,43,0,1,0
어제 보니까 이 카페 진짜 맛있더라! 메뉴는 여기서 확인해봐 <URL> 주말에 같이 가자~ ☕️,ham_inf_1267,53,1,0,0
오늘 저녁은 뭐 먹을까? 여기 <URL> 가게 추천해줄게! 근데 전화는 <PHONE>으로 해보는 게 좋을 것 같아 ㅎㅎ,ham_inf_1268,66,1,1,0
"오늘 저녁에 뭐 할 건데? <PHONE>으로 알려줘, 같이 뭘 먹으러 갈까? 😊",ham_inf_1269,44,0,1,0
"야, 그때 말한 카페 주소 좀 보려고 하는데, 혹시 <PHONE>으로 문자 보내줄 수 있어? 😊",ham_inf_1270,53,0,1,0
"어제 본 그 영화 진짜 재밌더라! 예고편 여기서 볼 수 있어 <URL> 혹시 너의 평도 궁금한데, 나중에 가볍게 전화해줘 <PHONE> ㅎㅎ",ham_inf_1271,78,1,1,0
"야, 어제 맛있게 먹었던 그 카페 URL 보낼게! 다음에 같이 가자~ <URL> 그리고 내 번호도 다시 줄게, <PHONE>으로 연락해줘! 😊",ham_inf_1272,79,1,1,0
"이 웹사이트 진짜 유용해, 한번 들어가봐 <URL> 나도 다음 주에 활용해보려고! 😊",ham_inf_1273,47,1,0,0
"야, 그 영화 오늘 같이 보려고 했던 거, <PHONE>에 언제 시간 괜찮은지 알려줘~ 나도 궁금해서 ㅋㅋ",ham_inf_1274,59,0,1,0
이번 주말에 집에서 영화 보는데 같이 할래? <PHONE>으로 연락해줘~ ㅎㅎ,ham_inf_1275,43,0,1,0
"야, 이따 저녁에 만날 건데, <PHONE>으로 언제 도착하는지 연락 줘! ㅎㅎ 꽤 기대된다~",ham_inf_1276,52,0,1,0
"이번 주 토요일에 영화 보러 가는데, 시간 괜찮으면 같이 가자~ <PHONE>으로 연락 줘! ㅎㅎ",ham_inf_1277,54,0,1,0
오늘 저녁에 이태원에서 만나자! 그때 <URL> 보면서 메뉴 고르자~ 연락은 <PHONE>으로 해줘! ㅎㅎ,ham_inf_1278,59,1,1,0
"이번 주에 영화 보러 가는데, 같이 갈래? 예매는 여기서 할 수 있어! <URL> 그리고 나중에 연락할게! <PHONE> 😊",ham_inf_1279,69,1,1,0
"야, 이번에 새로 오픈한 카페 너무 예쁘던데! 메뉴도 다양하고, 사진 찍기 좋은 곳이라니까 여기 링크 한번 확인해봐: <URL> ㅎㅎ",ham_inf_1280,74,1,0,0
"야, 오늘 저녁 뭐 먹으려? 전화번호 <PHONE>으로 연락해봐!🍕 솔직히 좀 내기해볼래? ㅎㅎ",ham_inf_1281,53,0,1,0
"어제 재밌었던 그 영화 예고편 보고 왔는데, <URL>에서 확인할 수 있어! 나중에 같이 보러 가자~ 혹시나 늦을까 싶어서 <PHONE>으로 연락해줘 ㅎㅎ",ham_inf_1282,86,1,1,0
"이번 주말에 영화 보러 가자! 예매는 여기서 할 수 있어 <URL>, 내 번호는 <PHONE>니까 연락해줘~！！！",ham_inf_1283,63,1,1,0
이번에 새로 생긴 카페 가보는 거 어때? 주소는 여기야 <URL>! 나 궁금한데 같이 가자~ 전화는 <PHONE>으로 해줘! ㅋㅋ,ham_inf_1284,72,1,1,0
"어제 사진 잘 찍었으니까 포토북 만들자! <URL>에서 예쁜 디자인 고르고, 내 휴대폰 <PHONE>으로 연락해줘~ 😄",ham_inf_1285,66,1,1,0
"야, 다음 주 토요일에 우리 모임 있는데 자세한 내용은 여기서 확인해줘 <URL> 그리고 내 핸드폰 번호도 바꿨으니까 연락할 땐 <PHONE>으로 해! 확인해 보고 나중에 이야기하자~ 😊",ham_inf_1286,104,1,1,0
"이번 주말에 같이 영화 보러 가자! 전화번호 <PHONE>으로 연락해줘, 시간 조율하자 ㅎㅎ",ham_inf_1287,51,0,1,0
"야, 이번 주 토요일에 영화 보러 가려는데, 시간 괜찮은지 <PHONE>으로 알려줘! 잘 안 되는 날이 딱 있으면 그때는 다른 날로 잡자~ 😊",ham_inf_1288,79,0,1,0
"너, 이번 주 토요일에 공연 보러 갈 건데 같이 갈래? <PHONE>으로 답장해줘~ 😊",ham_inf_1289,48,0,1,0
"나 지난 주말에 재밌는 카페 발견했어! 여기 소개해줄게 <URL>, 같이 가면 진짜 좋을 듯~ 전화번호도 남길게 <PHONE> 너도 한번 가보자! ㅎㅎ",ham_inf_1290,84,1,1,0
"지난 주말에 간 카페 진짜 맛있었어! 나중에 같이 가자, 주소는 여기야 <URL> 그리고 전화번호도 확인해봐 <PHONE>ㅎㅎ",ham_inf_1291,70,1,1,0
오늘 저녁에 드디어 만나는 거야? 시간 맞춰서 <PHONE>으로 연락할게~ 기대된다! ㅎㅎ,ham_inf_1292,50,0,1,0
"이번 주 토요일에 친구들이랑 모임 하기로 했거든, 사정 생기면 <PHONE>으로 꼭 연락해줘! ㅎㅎ",ham_inf_1293,55,0,1,0
"야, 이번에 맛있는 카페 찾았어! 거기 후기 봐야 하는데, <URL> 링크로 가보면 진짜 예쁜 사진들이 많아! ㅋㅋ 같이 가자~",ham_inf_1294,71,1,0,0
"주말에 영화 보러 가기로 했는데, 시간 되면 <PHONE>으로 연락줘! 어떤 영화 볼지 정해야 하는데 고민이네 ㅎㅎ",ham_inf_1295,64,0,1,0
"오늘 저녁에 볼 영화 예매했는데, 여기 링크 첨부할게! <URL> 우리 같이 가자~~❤️",ham_inf_1296,49,1,0,0
"여기 맛있는 가게 찾았는데, 너도 같이 가고 싶으면 <PHONE>으로 연락해줘! ㅎㅎ",ham_inf_1297,47,0,1,0
"너! 이거 봐야해 😍 <URL>에서 할인하더라, 너도 확인해봐! 그리고 전화 번호도 남길게 <PHONE>, 혹시 궁금한 거 있으면 언제든지 연락해~",ham_inf_1298,82,1,1,0
"야, 그 영화 예고편 진짜 재밌더라! 같이 보러 가면 좋겠으니 여기를 한번 확인해봐 <URL> 그리고 언제 만날지 전화해줘 <PHONE> ㅎㅎ",ham_inf_1299,79,1,1,0
"야, 이번 주말에 영화 보러가자! 예매는 여기서 해도 돼 <URL>, 궁금한 거 있으면 나한테 문자해줘 <PHONE> ㅎㅎ",ham_inf_1300,68,1,1,0
"야, 나 이제 저녁 먹으러 가야 되는데 <PHONE>에 연락 좀 해줘! 배고파서 죽겠어 ㅎㅎ",ham_inf_1301,51,0,1,0
"야, 내일 시간 괜찮으면 오후 4시에 카페에서 같이 커피 마시고 이야기 좀 할까? <PHONE>으로 연락해줘~ ㅎㅎ",ham_inf_1302,64,0,1,0
"요즘 바빠서 자주 못 보는데, 이 주말에 시간 되면 나랑 같이 놀아~ 링크도 보내줄게: <URL> 그리고 혹시 시간 언제가 괜찮아? 연락은 <PHONE>으로 줘! 😊",ham_inf_1303,92,1,1,0
요즘 어떻게 지내? 다음 주에 시간되면 <PHONE>으로 연락해줘~ 같이 밥 먹자 ㅎㅎ,ham_inf_1304,48,0,1,0
"이번 주 주말에 놀러 갈 건데, 혹시 <PHONE>으로 연락하면 되지? 잘 지내고 있어? ㅎㅎ",ham_inf_1305,52,0,1,0
"요즘 너무 바빠서 핸드폰으로 연락 잘 못했네! 근데 다음 주에 시간 괜찮으면 <PHONE>으로 한번 통화하자, 이야기하고 싶은 게 많아ㅎㅎ",ham_inf_1306,77,0,1,0
"나 오늘 영화 보고 싶은데, 여기 예매 링크 올릴게! <URL> 재밌을 것 같아~ ㅎㅎ",ham_inf_1307,48,1,0,0
"야! 지난 주말에 갔던 카페 후기 여기 던져줄게 <URL>, 다음에는 같이 가자~ 그리고 너도 그때처럼 또 다른 데 한 번 더 가자! 전화는 <PHONE>으로 해~ ㅎㅎ",ham_inf_1308,94,1,1,0
"야, 이따 한잔 할 건데, <PHONE>으로 연락 줘~ 궁금한 얘기도 많고 ㅎㅎ!",ham_inf_1309,45,0,1,0
이번 주 토요일에 서울 가는데 같이 갈래? <PHONE>으로 연락줘~ ㅎㅎ,ham_inf_1310,41,0,1,0
어제 말한 그 카페 여기 링크야~ <URL> 나랑 같이 가자 ㅎㅎ,ham_inf_1311,36,1,0,0
"이 영화 진짜 재밌어, 예고편 여기에서 볼 수 있어 <URL> 꼭 확인해봐! 😄",ham_inf_1312,44,1,0,0
"어어, 이거 진짜 대박이야! 나중에 이 링크(<URL>) 한 번 보고, 저녁에 전화할게 <PHONE>~ ㅎㅎ 같이 얘기하자!",ham_inf_1313,69,1,1,0
"야, 이 영상 진짜 대박이야! 나도 보고 싶은데 여기 링크 있어 <URL> 다들 재밌다는데 너도 한 번 봐봐~ ㅎㅎ",ham_inf_1314,64,1,0,0
이번 주 토요일에 있을 파티 일정 확인하고 싶으면 <URL> 가서 확인해봐~ 기대된다 ㅎㅎ,ham_inf_1315,50,1,0,0
"이번 주말에 우리 집에서 영화 보려고 하는데, 여기 포스터 링크도 첨부할게! <URL> 너도 보고 싶은 거 있으면 말해줘~😊",ham_inf_1316,69,1,0,0
"요즘 내가 본 핫한 카페가 있는데, 거기서 먹은 케이크가 진짜 맛있었어! 사진도 올릴게, 여기 링크야 <URL> ㅋㅋ 한번 가봐!",ham_inf_1317,72,1,0,0
"요즘 영화도 재밌고 공연도 많은데, 너도 같이 가고 싶으면 여기 확인해봐 <URL>! 그리고 나중에 통화하자 <PHONE>! ㅎㅎ",ham_inf_1318,72,1,1,0
어제 네가 추천한 그 카페 진짜 좋더라! 그곳 메뉴 사진 여기 있어 <URL> 다시 가고 싶어 ㅎㅎ,ham_inf_1319,55,1,0,0
오늘 놀러가기 전에 이거 꼭 확인해 봐! 여기서 버튼 누르면 <URL>으로 가니까ㅎㅎ 전화는 <PHONE>으로 해줘~ 만나서 뭐 먹을지 정하자! 🎉,ham_inf_1320,82,1,1,0
"어제 영화 재밌었어! 다음엔 같이 보자~ 참고로 내 번호는 <PHONE>이야, 언제 연락해줘 ㅎㅎ",ham_inf_1321,54,0,1,0
"이따가 그 영화 예매하려고 하는데, 링크 여기 있어 <URL> 그리고 혹시 시간 괜찮으면 <PHONE>으로 연락해줘! 😊",ham_inf_1322,67,1,1,0
"어제 저녁 너무 재밌었지? 다음에 다시 만날 때 <PHONE>으로 연락해줘, 꼭!! ㅎㅎ",ham_inf_1323,49,0,1,0
"이번 주말에 영화 보러 가고 싶은데, 8시 예매는 여기서 할 수 있어! <URL> 그리고 혹시 시간 좋으면 주말에 전화해줘! <PHONE> ㅎㅎ",ham_inf_1324,80,1,1,0
우리 다음 주에 만나서 밥 먹을까? <PHONE>로 너 시간 좀 확인해줘~ 😊,ham_inf_1325,43,0,1,0
"오늘 저녁 뭐 먹을지 고민 중인데, 맛집 추천받고 싶으면 여기 들어가봐! <URL>ㅋㅋ",ham_inf_1326,48,1,0,0
너 이번 주말에 시간 어때? 내가 찾은 맛집 링크 보낼게~ <URL> 여기 진짜 맛있어! ㅎㅎ,ham_inf_1327,52,1,0,0
"이번 주말에 영화 보러 가려고 하는데, 너도 올래? 연락해줘 <PHONE>ㅎㅎ",ham_inf_1328,43,0,1,0
어제 집에 고양이랑 놀았는데 진짜 웃겼어 ㅋㅋ 다음 주에 만날 때 <PHONE>으로 다시 통화하자!,ham_inf_1329,55,0,1,0
"너가 다음주에 나랑 영화 보러 갈 때 <PHONE>으로 연락해줘, 거기서 다 같이 만나면 좋겠다! 😄",ham_inf_1330,56,0,1,0
"오늘 저녁에 영화 보러 갈 건데, 시간 맞춰서 <PHONE>으로 연락해줘! ㅎㅎ 기대된다~",ham_inf_1331,50,0,1,0
"요즘 저녁으로 뭐 먹을지 고민인데, 네가 추천해준 그 맛집 메뉴 여기에서 확인해봐 <URL> 너무 기대된다 ㅎㅎ",ham_inf_1332,62,1,0,0
"이번 주말에 시간 괜찮으면 같이 영화 보러 가자! 예매는 여기서 할 수 있어 <URL> 아, 그리고 전화번호도 남길게 <PHONE>~ 연락 줘! 😊",ham_inf_1333,82,1,1,0
"이번 주말에 같이 영화 보러 가는데, <PHONE>으로 연락해줘! 뭐 보고 싶은지 얘기해보자~ 😊",ham_inf_1334,54,0,1,0
"야, 내일 시간 괜찮아? <PHONE>으로 연락줘~ 같이 놀러 가자 ㅎㅎ",ham_inf_1335,40,0,1,0
"야, 나 오늘 저녁에 영화 보는데 같이 갈래? 시간 맞으면 <PHONE>으로 연락해줘! 😄",ham_inf_1336,50,0,1,0
"야, 이거 재밌는 거 발견했어! 😂 여기서 확인해봐 <URL>, 그리고 내일 오후에 전화해줘 <PHONE>, 같이 얘기하자~!",ham_inf_1337,70,1,1,0
어제 그 카페 사진 찍었는데 <URL>에서 확인해봐! 진짜 예쁘더라 ㅎㅎ,ham_inf_1338,40,1,0,0
